{
  "schema": 1,
  "id": "awe-volume-brightness",
  "category": "plugins",
  "version": "1.0.0",
  "destination": "ryoku/plugins/awe-volume-brightness",
  "files": [
    {
      "source": "LICENSE",
      "destination": "LICENSE",
      "sha256": "c9bff75738922193e67fa726fa225535870d2aa1059f91452c411736284ad566",
      "mode": "0644",
      "size": 1338,
      "install": false
    },
    {
      "source": "README.md",
      "destination": "README.md",
      "sha256": "91d64f603333afde05e1f6fc5a0dda00dc153f000cc7964fc49981e9aaa60052",
      "mode": "0644",
      "size": 867,
      "install": false
    },
    {
      "source": "assets/preview-widget.png",
      "destination": "assets/preview-widget.png",
      "sha256": "ff83ab7aceaf921e83664d3a3a3114666d505bdfc40bb0aeca06717b6f4ca1cb",
      "mode": "0644",
      "size": 20382,
      "install": false
    },
    {
      "source": "content/Theme.qml",
      "destination": "content/Theme.qml",
      "sha256": "c08c09387c91028f02552346793a7a960bffd9c7307294ee7ea4fca4179a3c84",
      "mode": "0644",
      "size": 13387,
      "install": true
    },
    {
      "source": "content/VolumeBrightnessWidget.qml",
      "destination": "content/VolumeBrightnessWidget.qml",
      "sha256": "54e0a91c5811c9ffd4eb64b140d60cee27d261a5d40b467c5f697cc4bc02360e",
      "mode": "0644",
      "size": 15625,
      "install": true
    },
    {
      "source": "content/Widget.qml",
      "destination": "content/Widget.qml",
      "sha256": "3df5845a8a45daafa793f52b91e281edd40aa3be662af877a7ad15ba5089c6cc",
      "mode": "0644",
      "size": 1092,
      "install": true
    },
    {
      "source": "content/qmldir",
      "destination": "content/qmldir",
      "sha256": "8ecfb3dc8d467739a330669e8866a531c33b81f05b0158c4441259ed54cba5af",
      "mode": "0644",
      "size": 80,
      "install": true
    },
    {
      "source": "manifest.json",
      "destination": "manifest.json",
      "sha256": "2f863def085b8f2c557d11bff3a00d60b1b3d37be7dcae37693a8fe34fd01dc1",
      "mode": "0644",
      "size": 1072,
      "install": true
    },
    {
      "source": "service/Main.qml",
      "destination": "service/Main.qml",
      "sha256": "49d5233fd543e6c5e6100d96ad21c484c2606e5da1f734b70c42ccd8615f41ac",
      "mode": "0644",
      "size": 97,
      "install": true
    }
  ]
}
