{
  "schema": 1,
  "id": "awe-battery",
  "category": "plugins",
  "version": "1.0.0",
  "destination": "ryoku/plugins/awe-battery",
  "files": [
    {
      "source": "LICENSE",
      "destination": "LICENSE",
      "sha256": "c9bff75738922193e67fa726fa225535870d2aa1059f91452c411736284ad566",
      "mode": "0644",
      "size": 1338,
      "install": false
    },
    {
      "source": "README.md",
      "destination": "README.md",
      "sha256": "fb3172a7d5a65ecbabeb4594e760b6f4ece1e455ef34eab55c613a91ba749aee",
      "mode": "0644",
      "size": 737,
      "install": false
    },
    {
      "source": "assets/preview-widget.png",
      "destination": "assets/preview-widget.png",
      "sha256": "56beae3f7a84f7cb2d026a796f4783c138489e8996f1fb5aa711eca981dd43a3",
      "mode": "0644",
      "size": 12984,
      "install": false
    },
    {
      "source": "content/BatteryWidget.qml",
      "destination": "content/BatteryWidget.qml",
      "sha256": "aa7c6c85fa6847cf026a2c1e7903381a2ae24f65fd4ec2851e86ce6454f4522a",
      "mode": "0644",
      "size": 7326,
      "install": true
    },
    {
      "source": "content/Theme.qml",
      "destination": "content/Theme.qml",
      "sha256": "c08c09387c91028f02552346793a7a960bffd9c7307294ee7ea4fca4179a3c84",
      "mode": "0644",
      "size": 13387,
      "install": true
    },
    {
      "source": "content/Widget.qml",
      "destination": "content/Widget.qml",
      "sha256": "3fce92484cad870824efa3c78c535fb1ed498b21fcd17c8c909db6f7a77205ec",
      "mode": "0644",
      "size": 1085,
      "install": true
    },
    {
      "source": "content/qmldir",
      "destination": "content/qmldir",
      "sha256": "b1dea27546f62789dfb40d280d5c203ff9ad3faa50d89ebcb5e36904fefa8ba3",
      "mode": "0644",
      "size": 62,
      "install": true
    },
    {
      "source": "manifest.json",
      "destination": "manifest.json",
      "sha256": "d4037cf07f3c719102f054bbd17289e307854bc4469dd679a402d77aa2e1da61",
      "mode": "0644",
      "size": 1035,
      "install": true
    },
    {
      "source": "service/Main.qml",
      "destination": "service/Main.qml",
      "sha256": "49d5233fd543e6c5e6100d96ad21c484c2606e5da1f734b70c42ccd8615f41ac",
      "mode": "0644",
      "size": 97,
      "install": true
    }
  ]
}
