{
  "schema": 1,
  "id": "mjw-storage-map",
  "category": "plugins",
  "version": "1.0.3",
  "destination": "ryoku/plugins/mjw-storage-map",
  "files": [
    {
      "source": "LICENSE",
      "destination": "LICENSE",
      "sha256": "c9bff75738922193e67fa726fa225535870d2aa1059f91452c411736284ad566",
      "mode": "0644",
      "size": 1338,
      "install": false
    },
    {
      "source": "README.md",
      "destination": "README.md",
      "sha256": "dd422ac831bf8560d8f1430f264a5390f69dfb94f5490d32f418040bda1c94ec",
      "mode": "0644",
      "size": 729,
      "install": false
    },
    {
      "source": "assets/preview-widget.png",
      "destination": "assets/preview-widget.png",
      "sha256": "2a2ea1c9da5cede12fc7fcb8b67deb33d359ead43f08623dde213d54515ca33c",
      "mode": "0644",
      "size": 20922,
      "install": false
    },
    {
      "source": "content/StorageMapWidget.qml",
      "destination": "content/StorageMapWidget.qml",
      "sha256": "c46375bcb5874dc501810a7a9b5d567281570344652c6c238add91ca539c413d",
      "mode": "0644",
      "size": 8552,
      "install": true
    },
    {
      "source": "content/Theme.qml",
      "destination": "content/Theme.qml",
      "sha256": "c08c09387c91028f02552346793a7a960bffd9c7307294ee7ea4fca4179a3c84",
      "mode": "0644",
      "size": 13387,
      "install": true
    },
    {
      "source": "content/Widget.qml",
      "destination": "content/Widget.qml",
      "sha256": "c1d75aeb4f223a10c0971fe49b92ab36137343cae2fded7de662c6d9c1105025",
      "mode": "0644",
      "size": 1088,
      "install": true
    },
    {
      "source": "content/qmldir",
      "destination": "content/qmldir",
      "sha256": "ae1989bef17914c358a7ff545217079be98a076ef96b4206613f79ff466fac89",
      "mode": "0644",
      "size": 68,
      "install": true
    },
    {
      "source": "manifest.json",
      "destination": "manifest.json",
      "sha256": "b8fbb5003ec7233a12a37edb013d56939a01235a97eb278ddfe922fccb7d89a0",
      "mode": "0644",
      "size": 1111,
      "install": true
    },
    {
      "source": "service/Main.qml",
      "destination": "service/Main.qml",
      "sha256": "49d5233fd543e6c5e6100d96ad21c484c2606e5da1f734b70c42ccd8615f41ac",
      "mode": "0644",
      "size": 97,
      "install": true
    }
  ]
}
