{
  "schema": 1,
  "id": "awe-clock",
  "category": "plugins",
  "version": "1.0.1",
  "destination": "ryoku/plugins/awe-clock",
  "files": [
    {
      "source": "LICENSE",
      "destination": "LICENSE",
      "sha256": "c9bff75738922193e67fa726fa225535870d2aa1059f91452c411736284ad566",
      "mode": "0644",
      "size": 1338,
      "install": false
    },
    {
      "source": "README.md",
      "destination": "README.md",
      "sha256": "4dda35ded78be10d986b1cb4db5d3ecd30dc78cc3198faa25494b17b68bdc799",
      "mode": "0644",
      "size": 541,
      "install": false
    },
    {
      "source": "assets/preview-widget.png",
      "destination": "assets/preview-widget.png",
      "sha256": "016acb9c8c5bf916e1e3d3ae08877529b365fb3fba029e1da567e67772cd76bf",
      "mode": "0644",
      "size": 43428,
      "install": false
    },
    {
      "source": "content/Clock.qml",
      "destination": "content/Clock.qml",
      "sha256": "4676de025b8af7308fb0f291a02f4a67655f6baa642f13b013003e1652243879",
      "mode": "0644",
      "size": 23398,
      "install": true
    },
    {
      "source": "content/Theme.qml",
      "destination": "content/Theme.qml",
      "sha256": "679a78816db7eb853f7e30cf54a2225cc4a6807ca4c0166bd052a5b0611abc72",
      "mode": "0644",
      "size": 13521,
      "install": true
    },
    {
      "source": "content/Widget.qml",
      "destination": "content/Widget.qml",
      "sha256": "e16f3c07776ad1201cc0527941485d27295e74b069e7cca52529a4c6894228fb",
      "mode": "0644",
      "size": 1274,
      "install": true
    },
    {
      "source": "content/qmldir",
      "destination": "content/qmldir",
      "sha256": "2c7b3dc2871cab14c39263b82b9f0810eb46826e8523341c9ffc18107f8223d1",
      "mode": "0644",
      "size": 46,
      "install": true
    },
    {
      "source": "manifest.json",
      "destination": "manifest.json",
      "sha256": "6ace7e9df4d1ec5e81c6c2d58b3b4d2237623123892625851391018683149574",
      "mode": "0644",
      "size": 969,
      "install": true
    },
    {
      "source": "service/Main.qml",
      "destination": "service/Main.qml",
      "sha256": "49d5233fd543e6c5e6100d96ad21c484c2606e5da1f734b70c42ccd8615f41ac",
      "mode": "0644",
      "size": 97,
      "install": true
    }
  ]
}
