{
  "schema": 1,
  "id": "mjw-calc",
  "category": "plugins",
  "version": "1.0.3",
  "destination": "ryoku/plugins/mjw-calc",
  "files": [
    {
      "source": "LICENSE",
      "destination": "LICENSE",
      "sha256": "c9bff75738922193e67fa726fa225535870d2aa1059f91452c411736284ad566",
      "mode": "0644",
      "size": 1338,
      "install": false
    },
    {
      "source": "README.md",
      "destination": "README.md",
      "sha256": "59c27e3789e34024912a958c295ab4df9b0adebb73a1f23813a1ba9403ef037f",
      "mode": "0644",
      "size": 703,
      "install": false
    },
    {
      "source": "assets/preview-widget.png",
      "destination": "assets/preview-widget.png",
      "sha256": "50f43949bd3cae77e67711d57ec9576261a1644d578da22be786032a71452175",
      "mode": "0644",
      "size": 30509,
      "install": false
    },
    {
      "source": "content/CalcWidget.qml",
      "destination": "content/CalcWidget.qml",
      "sha256": "55654b9df71c278391aed592b80e2cef008646e3a716cd4d69c67ad5d93dd65e",
      "mode": "0644",
      "size": 14477,
      "install": true
    },
    {
      "source": "content/Theme.qml",
      "destination": "content/Theme.qml",
      "sha256": "679a78816db7eb853f7e30cf54a2225cc4a6807ca4c0166bd052a5b0611abc72",
      "mode": "0644",
      "size": 13521,
      "install": true
    },
    {
      "source": "content/Widget.qml",
      "destination": "content/Widget.qml",
      "sha256": "29e62abebbb3784e96b06e64706ac61a9e2e6c8fc45b3dc246dee8a096900318",
      "mode": "0644",
      "size": 1279,
      "install": true
    },
    {
      "source": "content/qmldir",
      "destination": "content/qmldir",
      "sha256": "b0969d410e5ef3b83d3195452ce38d685bf9a00749a4a35497080c6017dbb23c",
      "mode": "0644",
      "size": 56,
      "install": true
    },
    {
      "source": "manifest.json",
      "destination": "manifest.json",
      "sha256": "460fbefa68e588adb5fb021b098c7af221d5c3024934407309923e982752dd9a",
      "mode": "0644",
      "size": 1054,
      "install": true
    },
    {
      "source": "service/Main.qml",
      "destination": "service/Main.qml",
      "sha256": "49d5233fd543e6c5e6100d96ad21c484c2606e5da1f734b70c42ccd8615f41ac",
      "mode": "0644",
      "size": 97,
      "install": true
    }
  ]
}
