{
  "schema": 1,
  "id": "awe-poster",
  "category": "plugins",
  "version": "1.0.1",
  "destination": "ryoku/plugins/awe-poster",
  "files": [
    {
      "source": "LICENSE",
      "destination": "LICENSE",
      "sha256": "c9bff75738922193e67fa726fa225535870d2aa1059f91452c411736284ad566",
      "mode": "0644",
      "size": 1338,
      "install": false
    },
    {
      "source": "README.md",
      "destination": "README.md",
      "sha256": "64dd1286e4b73e626a378260ab82f10b90785f78d9e6a0f517aa8fc4f430ce03",
      "mode": "0644",
      "size": 932,
      "install": false
    },
    {
      "source": "assets/preview-widget.png",
      "destination": "assets/preview-widget.png",
      "sha256": "b1b93179e055293531f96f29473634f965bd3c785043aeac55fb0592ed164182",
      "mode": "0644",
      "size": 12909,
      "install": false
    },
    {
      "source": "content/PosterWidget.qml",
      "destination": "content/PosterWidget.qml",
      "sha256": "70f6b5a3bd679d46ff6e83120f9bc8005207138c90442a0f82de702ec75d13b0",
      "mode": "0644",
      "size": 10120,
      "install": true
    },
    {
      "source": "content/Theme.qml",
      "destination": "content/Theme.qml",
      "sha256": "c08c09387c91028f02552346793a7a960bffd9c7307294ee7ea4fca4179a3c84",
      "mode": "0644",
      "size": 13387,
      "install": true
    },
    {
      "source": "content/Widget.qml",
      "destination": "content/Widget.qml",
      "sha256": "e279177e109291b5bc82630d105c246aa8a17c85511bf56f8b8ea22a00c7069c",
      "mode": "0644",
      "size": 1082,
      "install": true
    },
    {
      "source": "content/qmldir",
      "destination": "content/qmldir",
      "sha256": "c930fea3311a86b5552310bdafb06cf0218e7084dd724e81dcd9e81cefa8f880",
      "mode": "0644",
      "size": 60,
      "install": true
    },
    {
      "source": "manifest.json",
      "destination": "manifest.json",
      "sha256": "d5ea6181e04018562609dde9ae8899e7ec596cb9121bbb4a08226480a6c4405c",
      "mode": "0644",
      "size": 963,
      "install": true
    },
    {
      "source": "service/Main.qml",
      "destination": "service/Main.qml",
      "sha256": "49d5233fd543e6c5e6100d96ad21c484c2606e5da1f734b70c42ccd8615f41ac",
      "mode": "0644",
      "size": 97,
      "install": true
    }
  ]
}
