{
  "schema": 1,
  "id": "vpn",
  "category": "plugins",
  "version": "2.0.0",
  "destination": "ryoku/plugins/vpn",
  "files": [
    {
      "source": "LICENSE",
      "destination": "LICENSE",
      "sha256": "8a7d40314e0d657fa3f9f969f2fdbbb5e0ca58cc8b756a0c3d8258878c1b31c3",
      "mode": "0644",
      "size": 1065,
      "install": false
    },
    {
      "source": "README.md",
      "destination": "README.md",
      "sha256": "16a13daf4dea10d5040fda3e9e990e6ee5f43480cda63651972e7a35fc6ed6db",
      "mode": "0644",
      "size": 4572,
      "install": false
    },
    {
      "source": "assets/preview-desktop.png",
      "destination": "assets/preview-desktop.png",
      "sha256": "9fb8b0b203abe715dec6347728859c36d93679b037222c02f8725031663912f5",
      "mode": "0644",
      "size": 187613,
      "install": false
    },
    {
      "source": "assets/preview-widget.png",
      "destination": "assets/preview-widget.png",
      "sha256": "7f06135117d1ee94e1665f04c193d87bc9abdfdc72e2e277cd4a32707404e9ad",
      "mode": "0644",
      "size": 51983,
      "install": false
    },
    {
      "source": "content/Card.qml",
      "destination": "content/Card.qml",
      "sha256": "15283c34f91afae9818244c8ec4c9cf691beb165f6077be8b9515f0eec107b9e",
      "mode": "0644",
      "size": 14346,
      "install": true
    },
    {
        "source": "content/Glyph.qml",
        "destination": "content/Glyph.qml",
        "sha256": "302fb0a2163bbf88ab8d73f2ebd57c8b01b69ab5fdaf36534deffaf2df6b57a5",
        "mode": "0644",
        "size": 4046,
        "install": true
    },
    {
      "source": "content/InfoRow.qml",
      "destination": "content/InfoRow.qml",
      "sha256": "75e4b5c02fb92121b2787b32fa0a4da63c65599ac90dc50d624dfbe60c414214",
      "mode": "0644",
      "size": 2893,
      "install": true
    },
    {
      "source": "content/Panel.qml",
      "destination": "content/Panel.qml",
      "sha256": "0ca1e6e135d1142178b3d104773f8fc0d71d86ced122d3dd71fcf68881705268",
      "mode": "0644",
      "size": 15288,
      "install": true
    },
    {
      "source": "content/Widget.qml",
      "destination": "content/Widget.qml",
      "sha256": "438e62c1185a3ae6433dbf898397bf9da3bee0015bce20a27ce5c72611b082dc",
      "mode": "0644",
      "size": 1303,
      "install": true
    },
    {
      "source": "manifest.json",
      "destination": "manifest.json",
      "sha256": "af8cf7da1c281b130d7973fc1c9ccbea5aba043fbff95d2fc272eb7d65c13b77",
      "mode": "0644",
      "size": 2010,
      "install": true
    },
    {
      "source": "service/Main.qml",
      "destination": "service/Main.qml",
      "sha256": "02725bbdb386da47fc16c4273137e6da77634b7cd823fb7d7dfe8a108a5a1b7f",
      "mode": "0644",
      "size": 20304,
      "install": true
    }
  ]
}
