{
  "schema": 1,
  "id": "awe-media",
  "category": "plugins",
  "version": "1.0.0",
  "destination": "ryoku/plugins/awe-media",
  "files": [
    {
      "source": "LICENSE",
      "destination": "LICENSE",
      "sha256": "c9bff75738922193e67fa726fa225535870d2aa1059f91452c411736284ad566",
      "mode": "0644",
      "size": 1338,
      "install": false
    },
    {
      "source": "README.md",
      "destination": "README.md",
      "sha256": "5fdaa41bc3e3d1bfea9fd82e960d8cfbdff1c8dab9ec4199f4dae47c58737129",
      "mode": "0644",
      "size": 429,
      "install": false
    },
    {
      "source": "assets/preview-widget.png",
      "destination": "assets/preview-widget.png",
      "sha256": "1f0a5ff147b6153278f6983eedf2796fe8e836dbd397226e05de1fa7aea12fdc",
      "mode": "0644",
      "size": 25910,
      "install": false
    },
    {
      "source": "content/MediaWidget.qml",
      "destination": "content/MediaWidget.qml",
      "sha256": "1654d69d1c0a9c9fcb52a9de880e41bd34096df882a405a725d9bebab2050425",
      "mode": "0644",
      "size": 29728,
      "install": true
    },
    {
      "source": "content/Theme.qml",
      "destination": "content/Theme.qml",
      "sha256": "c08c09387c91028f02552346793a7a960bffd9c7307294ee7ea4fca4179a3c84",
      "mode": "0644",
      "size": 13387,
      "install": true
    },
    {
      "source": "content/Widget.qml",
      "destination": "content/Widget.qml",
      "sha256": "273faa1c20dddca1da0ba84ce1dedecf3686ecd70abf2bbee9fcc08dedc9b932",
      "mode": "0644",
      "size": 1081,
      "install": true
    },
    {
      "source": "content/qmldir",
      "destination": "content/qmldir",
      "sha256": "256d5042656fae2a1ca98c655a34e703dce36062cfa07a9a9a6b3accfb2a9a65",
      "mode": "0644",
      "size": 58,
      "install": true
    },
    {
      "source": "manifest.json",
      "destination": "manifest.json",
      "sha256": "9170dc3e5583c5adf41d3ed6fdbd383b22dd941534f0898f2dab915f4b437c13",
      "mode": "0644",
      "size": 1033,
      "install": true
    },
    {
      "source": "service/Main.qml",
      "destination": "service/Main.qml",
      "sha256": "49d5233fd543e6c5e6100d96ad21c484c2606e5da1f734b70c42ccd8615f41ac",
      "mode": "0644",
      "size": 97,
      "install": true
    }
  ]
}
