{
  "schema": 1,
  "id": "sugar-tracker",
  "category": "plugins",
  "version": "1.0.9",
  "destination": "ryoku/plugins/sugar-tracker",
  "files": [
    {
      "source": ".gitignore",
      "destination": ".gitignore",
      "sha256": "cf237c7aff44efbe6e502e645c3e06da03a69d7bdeb43392108ef3348143417e",
      "mode": "0644",
      "size": 10,
      "install": true
    },
    {
      "source": "LICENSE",
      "destination": "LICENSE",
      "sha256": "20dd49cffa29f7642793b22e7058a84bdd0f99f6194f589a2553224348783489",
      "mode": "0644",
      "size": 1062,
      "install": false
    },
    {
      "source": "README.md",
      "destination": "README.md",
      "sha256": "f06a310f53db6350a5d4ba91d8295bce50c342ee07966baae2e3f12187d18031",
      "mode": "0644",
      "size": 3616,
      "install": false
    },
    {
      "source": "content/Panel.qml",
      "destination": "content/Panel.qml",
      "sha256": "e510e68808412a714df4b8a3234ace870c6febc886afdd3896ffa9d5e642b5bf",
      "mode": "0644",
      "size": 16038,
      "install": true
    },
    {
      "source": "content/Widget.qml",
      "destination": "content/Widget.qml",
      "sha256": "cc7303ab5f040b5b9e94e79d8ce59dc19aef06a4ab6148b50c50622c3e27b71e",
      "mode": "0644",
      "size": 3772,
      "install": true
    },
    {
      "source": "manifest.json",
      "destination": "manifest.json",
      "sha256": "4b85764be2d9ae53ac09f49530bb1904a9faf63510f1e12d82f6fd3435870ffe",
      "mode": "0644",
      "size": 2193,
      "install": true
    },
    {
      "source": "service/Main.qml",
      "destination": "service/Main.qml",
      "sha256": "2886776f8d177b2405f46d4854fe4610a82c3fd22c75135b16b99f7d87ac95a9",
      "mode": "0644",
      "size": 3194,
      "install": true
    },
    {
      "source": "preview.png",
      "destination": "preview.png",
      "sha256": "88be140b6abdacec48112f04639ecad34d8079df194601d7ff33917f2eb013d9",
      "mode": "0644",
      "size": 115761,
      "install": false
    }
  ]
}
